{
  "document": {
    "id": "cl.construction.review_plan.v1",
    "status": "draft_not_admitted",
    "source_branch": "spec/clauditor-otel-compliance-v1-20261023",
    "source_commit": "44ca22d86ea15b6c9e76d84217cbabf37bd5cda9",
    "source_model_blob": "3e516bcb3468ebbbb03a08ec4309e226e1c3a14b",
    "source_registry_blob": "dcb679edb51132b4954fd5eabb12c0db64134c3b",
    "active_bcf_profile": "lite",
    "bcf_release": "v2.3.6",
    "target": "standard v3 without a persistent controller",
    "scope": "planning artifacts only; no implementation or phase activation",
    "runtime_authority": false,
    "release_authority": false
  },
  "authority": {
    "root_lifecycle_owner": "plans/phase-ledger.yml (P01 foundation remains in place)",
    "root_build_plan": "plans/build-plan.yml requires governed adoption after approved specification",
    "canonical_bcf": "AGENTS.yml, governance/, plans/, schemas/; generated CI workflow is not editable",
    "packets": "Candidate A-J packets, not BCF phase-workitems schema or admissible execution notices",
    "approval_required": "Owner intent and authenticated BCF dependency/subject/evidence preflight"
  },
  "work_orders": [
    {
      "id": "CL-WO-001",
      "complexity": "medium",
      "phase": "P02",
      "title": "Bind owner intent, baseline and change authority before constructing dependent contracts.",
      "owner": "cl.owner.governance.v1",
      "requirements": [
        "cl.req.029.v1",
        "cl.req.030.v1",
        "cl.req.037.v1",
        "cl.req.038.v1"
      ],
      "depends_on": [],
      "primary_output": "spec/clauditor/v1/construction/authority/decisions.json",
      "write_roots": [
        "spec/clauditor/v1/construction/authority/"
      ],
      "locks": [
        "owner-review"
      ],
      "admitted": false
    },
    {
      "id": "CL-WO-002",
      "complexity": "high",
      "phase": "P02",
      "title": "Qualify Cowork, Claude Code, API and SDK signal/content capabilities and source enrollment prerequisites.",
      "owner": "cl.owner.source.v1",
      "requirements": [
        "cl.req.001.v1",
        "cl.req.002.v1",
        "cl.req.003.v1",
        "cl.req.004.v1",
        "cl.req.005.v1",
        "cl.req.006.v1",
        "cl.req.007.v1",
        "cl.req.008.v1"
      ],
      "depends_on": [],
      "primary_output": "spec/clauditor/v1/research/sources/capability-matrix.json",
      "write_roots": [
        "spec/clauditor/v1/research/sources/"
      ],
      "locks": [
        "source-research"
      ],
      "admitted": false
    },
    {
      "id": "CL-WO-003",
      "complexity": "medium",
      "phase": "P02",
      "title": "Qualify free self-hosted image/plugin versions, dependencies, stability and ClickHouse exporter behavior.",
      "owner": "cl.owner.deployment.v1",
      "requirements": [
        "cl.req.013.v1",
        "cl.req.016.v1",
        "cl.req.022.v1",
        "cl.req.027.v1",
        "cl.req.034.v1"
      ],
      "depends_on": [],
      "primary_output": "spec/clauditor/v1/research/components/pins-and-licenses.json",
      "write_roots": [
        "spec/clauditor/v1/research/components/"
      ],
      "locks": [
        "license-review"
      ],
      "admitted": false
    },
    {
      "id": "CL-WO-004",
      "complexity": "high",
      "phase": "P02",
      "title": "Fix local admin/viewer, secret, SQL, content privacy and OSS audit expectations.",
      "owner": "cl.owner.security.v1",
      "requirements": [
        "cl.req.017.v1",
        "cl.req.019.v1",
        "cl.req.020.v1",
        "cl.req.026.v1",
        "cl.req.033.v1",
        "cl.req.036.v1"
      ],
      "depends_on": [
        "CL-WO-001"
      ],
      "primary_output": "spec/clauditor/v1/design/security/roles-and-sensitive-content.json",
      "write_roots": [
        "spec/clauditor/v1/design/security/"
      ],
      "locks": [
        "privacy-review"
      ],
      "admitted": false
    },
    {
      "id": "CL-WO-005",
      "complexity": "high",
      "phase": "P02",
      "title": "Reconcile canonical semantics, independent required paths and typed state/edge exclusions.",
      "owner": "cl.owner.governance.v1",
      "requirements": [
        "cl.req.030.v1",
        "cl.req.037.v1",
        "cl.req.038.v1",
        "cl.req.039.v1"
      ],
      "depends_on": [
        "CL-WO-001",
        "CL-WO-002",
        "CL-WO-004"
      ],
      "primary_output": "spec/clauditor/v1/reviews/closure/proof.json",
      "write_roots": [
        "spec/clauditor/v1/model.json",
        "spec/clauditor/v1/schema/",
        "spec/clauditor/v1/reviews/closure/"
      ],
      "locks": [
        "canonical-source-writer"
      ],
      "admitted": false
    },
    {
      "id": "CL-WO-006",
      "complexity": "medium",
      "phase": "P02",
      "title": "Build anonymized fixtures for OTLP signals, content limits and provider source types.",
      "owner": "cl.owner.source.v1",
      "requirements": [
        "cl.req.001.v1",
        "cl.req.002.v1",
        "cl.req.003.v1",
        "cl.req.004.v1",
        "cl.req.005.v1",
        "cl.req.008.v1",
        "cl.req.009.v1"
      ],
      "depends_on": [
        "CL-WO-002",
        "CL-WO-005"
      ],
      "primary_output": "tests/fixtures/anthropic/manifest.json",
      "write_roots": [
        "tests/fixtures/anthropic/"
      ],
      "locks": [
        "fixture-writer"
      ],
      "admitted": false
    },
    {
      "id": "CL-WO-007",
      "complexity": "high",
      "phase": "P02",
      "title": "Contract OTLP authorization, partial success, durable queues and multi-stage receipts.",
      "owner": "cl.owner.ingress.v1",
      "requirements": [
        "cl.req.009.v1",
        "cl.req.010.v1",
        "cl.req.011.v1",
        "cl.req.031.v1"
      ],
      "depends_on": [
        "CL-WO-003",
        "CL-WO-005",
        "CL-WO-006"
      ],
      "primary_output": "spec/clauditor/v1/design/ingress/transport-receipts.json",
      "write_roots": [
        "spec/clauditor/v1/design/ingress/"
      ],
      "locks": [
        "ingress-contract"
      ],
      "admitted": false
    },
    {
      "id": "CL-WO-008",
      "complexity": "high",
      "phase": "P02",
      "title": "Contract semantically typed OTLP preservation, ClickHouse projections and deduplication.",
      "owner": "cl.owner.storage.v1",
      "requirements": [
        "cl.req.012.v1",
        "cl.req.013.v1",
        "cl.req.015.v1",
        "cl.req.034.v1"
      ],
      "depends_on": [
        "CL-WO-003",
        "CL-WO-005",
        "CL-WO-006"
      ],
      "primary_output": "spec/clauditor/v1/design/storage/typed-archive-sql.json",
      "write_roots": [
        "spec/clauditor/v1/design/storage/"
      ],
      "locks": [
        "storage-contract"
      ],
      "admitted": false
    },
    {
      "id": "CL-WO-009",
      "complexity": "high",
      "phase": "P02",
      "title": "Define 365/90/31-day retention, holds, export custody and capacity downgrade controls.",
      "owner": "cl.owner.storage.v1",
      "requirements": [
        "cl.req.014.v1",
        "cl.req.015.v1",
        "cl.req.019.v1",
        "cl.req.023.v1"
      ],
      "depends_on": [
        "CL-WO-003",
        "CL-WO-004",
        "CL-WO-005",
        "CL-WO-008"
      ],
      "primary_output": "spec/clauditor/v1/design/retention/holds-capacity.json",
      "write_roots": [
        "spec/clauditor/v1/design/retention/"
      ],
      "locks": [
        "retention-contract"
      ],
      "admitted": false
    },
    {
      "id": "CL-WO-010",
      "complexity": "high",
      "phase": "P02",
      "title": "Contract reviewer SQL access, correlation confidence, native Grafana capability and bounded exports.",
      "owner": "cl.owner.query.v1",
      "requirements": [
        "cl.req.016.v1",
        "cl.req.017.v1",
        "cl.req.018.v1",
        "cl.req.019.v1",
        "cl.req.020.v1",
        "cl.req.032.v1",
        "cl.req.033.v1"
      ],
      "depends_on": [
        "CL-WO-004",
        "CL-WO-005",
        "CL-WO-008"
      ],
      "primary_output": "spec/clauditor/v1/design/query/roles-correlation-export.json",
      "write_roots": [
        "spec/clauditor/v1/design/query/"
      ],
      "locks": [
        "query-contract"
      ],
      "admitted": false
    },
    {
      "id": "CL-WO-011",
      "complexity": "high",
      "phase": "P02",
      "title": "Contract observed compliance and health alert predicates, notification and uncertainty.",
      "owner": "cl.owner.alert.v1",
      "requirements": [
        "cl.req.024.v1",
        "cl.req.025.v1",
        "cl.req.028.v1",
        "cl.req.032.v1"
      ],
      "depends_on": [
        "CL-WO-004",
        "CL-WO-005",
        "CL-WO-008"
      ],
      "primary_output": "spec/clauditor/v1/design/alerts/rule-policy.json",
      "write_roots": [
        "spec/clauditor/v1/design/alerts/"
      ],
      "locks": [
        "alert-contract"
      ],
      "admitted": false
    },
    {
      "id": "CL-WO-012",
      "complexity": "medium",
      "phase": "P02",
      "title": "Specify one-host runtime budgets, persistent volumes, backup/restore and host TLS responsibilities.",
      "owner": "cl.owner.deployment.v1",
      "requirements": [
        "cl.req.021.v1",
        "cl.req.022.v1",
        "cl.req.023.v1",
        "cl.req.035.v1"
      ],
      "depends_on": [
        "CL-WO-003",
        "CL-WO-007",
        "CL-WO-008",
        "CL-WO-009"
      ],
      "primary_output": "spec/clauditor/v1/design/operations/host-and-recovery.json",
      "write_roots": [
        "spec/clauditor/v1/design/operations/"
      ],
      "locks": [
        "operations-contract"
      ],
      "admitted": false
    },
    {
      "id": "CL-WO-013",
      "complexity": "high",
      "phase": "P02",
      "title": "Review and reconcile approved candidate ownership with existing BCF root authorities without destructive replacement.",